<?xml version="1.0" encoding="UTF-8"?>
<xs:schema xmlns:xs="http://www.w3.org/2001/XMLSchema">

<!-- ##################################################################### -->
<!-- XML Schema Definition -->
<!-- ##################################################################### -->

<xs:element name="query">
	<xs:complexType>
		<xs:sequence>
			<xs:element name="queryID" type="xs:unsignedInt" />
			<xs:element name="clientID" type="xs:unsignedInt" />
			<xs:element name="date" type="xs:dateTime" />
			<xs:element name="language">
				<xs:simpleType>
					<!-- As seen in Tucux's DataType Enum -->
					<xs:restriction base="xs:string">
						<xs:enumeration value="en" />
						<xs:enumeration value="fr" />
						<xs:enumeration value="de" />
						<xs:enumeration value="it" />
					</xs:restriction>
				</xs:simpleType>
			</xs:element>
			<xs:element name="admin" type="adminType" minOccurs="0" />
			<xs:element name="parameters" type="parametersType" />
			<xs:element name="requests">
			<xs:complexType>
		        <xs:sequence>
		          <xs:element name="request" type="requestType" maxOccurs="unbounded" />
		        </xs:sequence>
			</xs:complexType>
		</xs:element>
		</xs:sequence>
		<xs:attribute name="version" use="required">
			<xs:simpleType>
				<xs:restriction base="xs:string">
				 	<!-- Version number beginning and ending with a number, 
				 	each number being separated by a dot -->
			     	<xs:pattern value="(((\d+)+\.)+)?(\d+)" />
			    </xs:restriction>
			</xs:simpleType>
		</xs:attribute>
	</xs:complexType>
</xs:element>

<!-- ##################################################################### -->
<!-- Global types for administrative informations -->
<!-- ##################################################################### -->

<!-- Everything is optional in this type -->
<xs:complexType name="adminType">
	<xs:sequence>
		<xs:element name="mandator" minOccurs="0">
			<xs:complexType>
				<xs:sequence>
					<xs:element name="person" minOccurs="0">
						<xs:complexType>
							<xs:sequence>
								<xs:element name="id" type="xs:string" minOccurs="0" />
								<xs:element name="title" type="xs:string" minOccurs="0" />
								<xs:element name="firstName" type="xs:string" minOccurs="0" />
								<xs:element name="lastName" type="xs:string" minOccurs="0" />
								<xs:group ref="contactGroup" minOccurs="0" />
							</xs:sequence>
						</xs:complexType>
					</xs:element>
					<xs:element name="institute" type="instituteType" minOccurs="0" />
				</xs:sequence>
			</xs:complexType>
		</xs:element>
		<xs:element name="patient" minOccurs="0">
			<xs:complexType>
				<xs:sequence>
					<xs:element name="person" minOccurs="0">
						<xs:complexType>
							<xs:sequence>
								<xs:element name="id" type="xs:string" minOccurs="0" />
								<xs:element name="firstName" type="xs:string" minOccurs="0" />
								<xs:element name="middleName" type="xs:string" minOccurs="0" />
								<xs:element name="lastName" type="xs:string" minOccurs="0" />
								<xs:element name="birthdate" type="xs:dateTime" minOccurs="0" />
								<xs:element name="gender" type="xs:string" minOccurs="0" />
								<xs:element name="hospitalStayNumber" type="xs:string" minOccurs="0" />
								<xs:group ref="contactGroup" minOccurs="0" />
							</xs:sequence>
						</xs:complexType>
					</xs:element>
					<xs:element name="institute" type="instituteType" minOccurs="0" />
				</xs:sequence>
			</xs:complexType>
		</xs:element>
		<xs:element name="clinicalData" minOccurs="0">
			<xs:complexType>
				<xs:sequence>
					<xs:any processContents="skip" maxOccurs="unbounded" />
				</xs:sequence>
			</xs:complexType>
		</xs:element>
	</xs:sequence>
</xs:complexType>

<xs:complexType name="instituteType">
	<xs:sequence>
		<xs:element name="id" type="xs:string" minOccurs="0" />
		<xs:element name="name" type="xs:string" minOccurs="0" />
		<xs:group ref="contactGroup" minOccurs="0" />
	</xs:sequence>
</xs:complexType>

<xs:complexType name="addressType">
	<xs:sequence>
		<xs:element name="street" type="xs:string" minOccurs="0" />
		<xs:element name="postCode" minOccurs="0">
			<xs:simpleType>
				 <xs:restriction base="xs:string">
				 	<!-- 4 digit number that can't begin with a 0 -->
			     	<xs:pattern value="[1-9]([0-9]{3})" />
			    </xs:restriction>
			</xs:simpleType>
		</xs:element>
		<xs:element name="city" type="xs:string" minOccurs="0" />
		<xs:element name="state" type="xs:string" minOccurs="0" />
		<xs:element name="country" type="xs:string" minOccurs="0" />
	</xs:sequence>
</xs:complexType>

<xs:complexType name="phoneType">
	<xs:sequence>
		<!-- Number hasn't a regex restriction because of other coutries phone numbers -->
		<xs:element name="number" type="xs:string" minOccurs="0" />
		<xs:element name="type" type="xs:string" minOccurs="0" />
	</xs:sequence>
</xs:complexType>

<xs:complexType name="emailType">
	<xs:sequence>
		<!-- Address hasn't a regex restriction because there's 
		a problem with meta characters for this particular regex -->
		<xs:element name="address" type="xs:string" minOccurs="0" />
		<xs:element name="type" type="xs:string" minOccurs="0" />
	</xs:sequence>
</xs:complexType>

<!-- ##################################################################### -->
<!-- Global groups for administrative informations -->
<!-- ##################################################################### -->

<xs:group name="contactGroup">
	<xs:sequence>
		<xs:element name="address" type="addressType" minOccurs="0" />
		<xs:element name="phone" type="phoneType" minOccurs="0" />
		<xs:element name="email" type="emailType" minOccurs="0" />
	</xs:sequence>
</xs:group>

<!-- ##################################################################### -->
<!-- Global types for query parameters -->
<!-- ##################################################################### -->

<xs:complexType name="parametersType">
	<xs:sequence>
		<xs:element name="patient">
			<xs:complexType>
				<xs:sequence>
					<xs:element name="covariates">
						<xs:complexType>
							<xs:sequence>
								<xs:element name="covariate" type="covariateType" maxOccurs="unbounded" />
							</xs:sequence>
						</xs:complexType>
					</xs:element>
				</xs:sequence>
			</xs:complexType>
		</xs:element>
		<xs:element name="drugs">
			<xs:complexType>
				<xs:sequence>
					<xs:element name="drug" type="drugType" maxOccurs="unbounded" />
				</xs:sequence>
			</xs:complexType>
		</xs:element>
	</xs:sequence>
</xs:complexType>

<xs:complexType name="covariateType">
	<xs:sequence>
		<xs:element name="name" type="xs:string" />
		<xs:element name="date" type="xs:dateTime" />
		<xs:element name="value" type="xs:string" />
		<xs:element name="unit" type="xs:string" />
		<xs:element name="dataType">
			<xs:simpleType>
				<!-- As seen in Tucux's DataType Enum -->
				<xs:restriction base="xs:string">
					<xs:enumeration value="Int" />
					<xs:enumeration value="Double" />
					<xs:enumeration value="Bool" />
					<xs:enumeration value="Date" />
				</xs:restriction>
			</xs:simpleType>
		</xs:element>
		<xs:element name="nature"  minOccurs="0">
			<xs:simpleType>
				<!-- As seen in the MOLIS specification -->
				<xs:restriction base="xs:string">
					<xs:enumeration value="continuous" />
					<xs:enumeration value="discrete" />
					<xs:enumeration value="categorical" />
				</xs:restriction>
			</xs:simpleType>
		</xs:element>
	</xs:sequence>
</xs:complexType>

<xs:complexType name="drugType">
	<xs:sequence>
		<xs:element name="drugID" type="xs:string" />
		<xs:element name="activePrinciple" type="xs:string" />
		<xs:element name="brandName" type="xs:string" />
		<xs:element name="atc" type="xs:string" />
		<xs:element name="treatment" type="treatmentType" />
		<xs:element name="samples" minOccurs="0">
			<xs:complexType>
		        <xs:sequence>
		          <xs:element name="sample" type="sampleType" maxOccurs="unbounded" />
		        </xs:sequence>
			</xs:complexType>
		</xs:element>
		<xs:element name="targets" minOccurs="0">
			<xs:complexType>
		        <xs:sequence>
		          <xs:element name="target" type="targetType" maxOccurs="unbounded" />
		        </xs:sequence>
			</xs:complexType>
		</xs:element>
	</xs:sequence>
</xs:complexType>

<xs:complexType name="treatmentType">
	<xs:sequence>
		<xs:element name="dosageHistory" type="dosageHistoryType" minOccurs="0" />
	</xs:sequence>
</xs:complexType>

<!-- This type and other linked types are made to be the most compatible 
with the DosageHistory class and AbstractDosage subclasses -->
<xs:complexType name="dosageHistoryType">
	<xs:sequence>
		<xs:element name="dosageTimeRange" type="dosageTimeRangeType" maxOccurs="unbounded" />
	</xs:sequence>
</xs:complexType>

<xs:complexType name="dosageTimeRangeType">
	<xs:sequence>
		<xs:group ref="dateIntervalGroup" />
		<xs:element name="dosage" type="dosageType" maxOccurs="unbounded" />
	</xs:sequence>
</xs:complexType>

<!-- Is the equivalent as the AbstractDosage class -->
<xs:complexType name="dosageType">
	<xs:choice>
		<xs:element name="dosageLoop" type="dosageLoopType" />
		<xs:group ref="dosageBoundedGroup" />
	</xs:choice>
</xs:complexType>

<xs:complexType name="dosageLoopType">
  <xs:sequence>
    <xs:group ref="dosageBoundedGroup" />
  </xs:sequence>
</xs:complexType>

<xs:complexType name="dosageRepeatType">
	<xs:sequence>
		<xs:element name="iterations">
			<xs:simpleType>
				<xs:restriction base="xs:int">
					<xs:minInclusive value="1" />
				</xs:restriction>
			</xs:simpleType>
		</xs:element>
		<xs:group ref="dosageBoundedGroup" />
	</xs:sequence>
</xs:complexType>

<xs:complexType name="dosageSequenceType">
	<xs:sequence>
		<xs:group ref="dosageBoundedGroup" maxOccurs="unbounded" />
	</xs:sequence>
</xs:complexType>

<xs:complexType name="lastingDosageType">
	<xs:sequence>
		<xs:element name="dateInterval" type="dateIntervalType" />
		<xs:group ref="intakeGroup" />
	</xs:sequence>
</xs:complexType>

<xs:complexType name="dailyDosageType">
	<xs:sequence>
		<xs:element name="time" type="xs:time" />
		<xs:group ref="intakeGroup" />
	</xs:sequence>
</xs:complexType>

<xs:complexType name="weeklyDosageType">
	<xs:sequence>
		<xs:element name="day">
		 	<xs:simpleType>
				<xs:restriction base="xs:int">
					<xs:minInclusive value="0" />
					<xs:maxInclusive value="6" />
				</xs:restriction>
			</xs:simpleType>
    	</xs:element>
		<xs:element name="time" type="xs:time" />
		<xs:group ref="intakeGroup" />
	</xs:sequence>
</xs:complexType>

<xs:complexType name="doseType">
	<xs:sequence>
		<xs:element name="value" type="xs:decimal" />
		<xs:element name="unit" type="xs:string" />
	</xs:sequence>
</xs:complexType>

<xs:complexType name="formulationAndRouteType">
	<xs:sequence>
		<xs:element name="formulation">
			<xs:simpleType>
				<!-- This enumeration is based on the one present in formulationandroute.h file in Tucuxi -->
				<xs:restriction base="xs:string">
		            <xs:enumeration value="Undefined" />
		            <xs:enumeration value="ParenteralSolution" />
		            <xs:enumeration value="OralSolution" />
		            <xs:enumeration value="Test" />
		        </xs:restriction>
			</xs:simpleType>
		</xs:element>
		<xs:element name="administrationName" type="xs:string" />
		<xs:element name="administrationRoute">
			<xs:simpleType>
				<!-- This enumeration is based on the one present in formulationandroute.h file in Tucuxi -->
				<xs:restriction base="xs:string">
		            <xs:enumeration value="Undefined" />
		            <xs:enumeration value="Intramuscular" />
		            <xs:enumeration value="IntravenousBolus" />
		            <xs:enumeration value="IntravenousDrip" />
		            <xs:enumeration value="Nasal" />
		            <xs:enumeration value="Oral" />
		            <xs:enumeration value="Rectal" />
		            <xs:enumeration value="Subcutaneous" />
		            <xs:enumeration value="Sublingual" />
		            <xs:enumeration value="Transdermal" />
		            <xs:enumeration value="Vaginal" />
		        </xs:restriction>
			</xs:simpleType>
		</xs:element>
		<xs:element name="absorbtionModel">
			<xs:simpleType>
				<!-- This enumeration is based on the one present in definitions.h file in Tucuxi -->
				<xs:restriction base="xs:string">
		            <xs:enumeration value="Undefined" />
		            <xs:enumeration value="Intravascular" />
		            <xs:enumeration value="Extravascular" />
		            <xs:enumeration value="Infusion" />
		        </xs:restriction>
			</xs:simpleType>
		</xs:element>
	</xs:sequence>
</xs:complexType>

<xs:complexType name="sampleType">
	<xs:sequence>
		<xs:element name="sampleID" type="xs:positiveInteger"/>
		<xs:element name="sampleDate" type="xs:dateTime" />
		<xs:element name="arrivalDate" type="xs:dateTime" />
		<xs:element name="concentrations">
	      	<xs:complexType>
		        <xs:sequence>
		          	<xs:element name="concentration" maxOccurs="unbounded">
				      	<xs:complexType>
				        	<xs:sequence>
				          		<xs:element name="analyteID" type="xs:string" />
					          	<xs:element name="value" type="xs:decimal" />
					          	<xs:element name="unit" type="xs:string" />
				        	</xs:sequence>
				      	</xs:complexType>
					</xs:element>
		        </xs:sequence>
	      	</xs:complexType>
		</xs:element>
		<xs:element name="likelyhoodUse" type="xs:boolean" minOccurs="0"/>
	</xs:sequence>
</xs:complexType>

<xs:complexType name="targetType">
	<xs:sequence>
		<xs:element name="activeMoietyID" type="xs:string" />
		<xs:element name="targetType">
			<xs:simpleType>
				<!-- This enumeration is based on the one present in the drug file's XSD -->
				<xs:restriction base="xs:string">
		            <xs:enumeration value="peak" />
		            <xs:enumeration value="residual" />
		            <xs:enumeration value="mean" />
		            <xs:enumeration value="auc" />
		            <xs:enumeration value="aucOverMic" /> <!-- In that case MIC should be a covariate -->
		            <xs:enumeration value="timeOverMic" /> <!-- In that case MIC should be a covariate -->
		            <xs:enumeration value="aucDividedByMic" /> <!-- In that case MIC should be a covariate -->
		            <xs:enumeration value="peakDividedByMic" /> <!-- In that case MIC should be a covariate -->
		        </xs:restriction>
			</xs:simpleType>
		</xs:element>
		<xs:element name="unit" type="xs:string" />
		<xs:element name="inefficacyAlarm" type="xs:decimal" />
		<xs:element name="min" type="xs:decimal" />
		<xs:element name="best" type="xs:decimal" />
		<xs:element name="max" type="xs:decimal" />
		<xs:element name="toxicityAlarm" type="xs:decimal" />
	</xs:sequence>
</xs:complexType>

<xs:complexType name="dateIntervalType">
	<xs:sequence>
		<xs:group ref="dateIntervalGroup" />
	</xs:sequence>
</xs:complexType>

<xs:complexType name="percentilesType">
	<xs:sequence>
		<xs:element name="percentile" maxOccurs="unbounded">
			<xs:simpleType>
				<xs:restriction base="xs:int">
					<xs:minInclusive value="0" />
					<xs:maxInclusive value="100" />
				</xs:restriction>
			</xs:simpleType>
		</xs:element>
	</xs:sequence>
</xs:complexType>

<xs:complexType name="graphType">
	<xs:sequence>
		<xs:element name="dateInterval" type="dateIntervalType" />
		<xs:element name="percentiles" type="percentilesType" />
	</xs:sequence>
</xs:complexType>

<!-- ##################################################################### -->
<!-- Global groups for query parameters -->
<!-- ##################################################################### -->

<xs:group name="dateIntervalGroup">
	<xs:sequence>
		<xs:element name="start" type="xs:dateTime" />
		<xs:element name="end" type="xs:dateTime" />
	</xs:sequence>
</xs:group>

<xs:group name="dosageBoundedGroup">
	<xs:choice>
		<xs:element name="dosageRepeat" type="dosageRepeatType" />
		<xs:element name="dosageSequence" type="dosageSequenceType" />
		<xs:choice>
			<xs:element name="lastingDosage" type="lastingDosageType" />
			<xs:element name="dailyDosage" type="dailyDosageType" />
			<xs:element name="weeklyDosage" type="weeklyDosageType" />
		</xs:choice>
	</xs:choice>
</xs:group>

<xs:group name="intakeGroup">
	<xs:sequence>
		<xs:element name="dose" type="doseType" />
		<xs:element name="formulationAndRoute" type="formulationAndRouteType" />
	</xs:sequence>
</xs:group>

<!-- ##################################################################### -->
<!-- Global types for requests -->
<!-- ##################################################################### -->

<xs:complexType name="requestType">
	<xs:sequence>
		<xs:element name="requestID" type="xs:string" />
		<xs:element name="drugID" type="xs:string" />
		<xs:element name="requestType">
			<xs:simpleType>
				<xs:restriction base="xs:string">
		            <xs:enumeration value="prediction" />
		            <xs:enumeration value="firstDosage" />
		            <xs:enumeration value="dosageRisk" />
		            <xs:enumeration value="dosageLikelyhood" />
		            <xs:enumeration value="dosageAdaptation" />
		            <xs:enumeration value="sampleDate" />
		            <xs:enumeration value="backextrapolation:dosageSearch" />
		            <xs:enumeration value="backextrapolation:dateSearch" />
		            <xs:enumeration value="sampleDate" />
		            <xs:enumeration value="report" />
		        </xs:restriction>
			</xs:simpleType>
		</xs:element>
		<xs:element name="dateInterval" type="dateIntervalType" minOccurs="0" />
		<xs:element name="predictionType" minOccurs="0">
			<xs:simpleType>
				<xs:restriction base="xs:string">
					<xs:enumeration value="population" />
					<xs:enumeration value="a priori" />
					<xs:enumeration value="a posteriori" />
					<xs:enumeration value="best" />
				</xs:restriction>
			</xs:simpleType>
		</xs:element>
		<xs:element name="graph" type="graphType" minOccurs="0" />
		<xs:element name="percentiles" type="percentilesType" minOccurs="0" />
		<xs:element name="backextrapolation" minOccurs="0">
			<xs:complexType>
				<xs:choice>
					<xs:group ref="BE_dosageSearchGroup" />
					<xs:group ref="BE_dateSearchGroup" />
				</xs:choice>
			</xs:complexType>
		</xs:element>
	</xs:sequence>
</xs:complexType>

<!-- ##################################################################### -->
<!-- Global groups for requests -->
<!-- ##################################################################### -->

<xs:group name="BE_dosageSearchGroup">
	<xs:sequence>
		<xs:element name="sample" type="sampleType" />
	</xs:sequence>
</xs:group>

<xs:group name="BE_dateSearchGroup">
	<xs:sequence>
		<xs:element name="incompleteSample">
			<xs:complexType>
				<xs:sequence>
					<xs:element name="sampleID" type="xs:positiveInteger"/>
					<xs:element name="arrivalDate" type="xs:dateTime" />
					<xs:element name="concentrations">
				      	<xs:complexType>
					        <xs:sequence>
					          	<xs:element name="concentration" maxOccurs="unbounded">
							      	<xs:complexType>
							        	<xs:sequence>
							          		<xs:element name="analyteID" type="xs:string" />
								          	<xs:element name="value" type="xs:decimal" />
								          	<xs:element name="unit" type="xs:string" />
							        	</xs:sequence>
							      	</xs:complexType>
								</xs:element>
					        </xs:sequence>
				      	</xs:complexType>
					</xs:element>
					<xs:element name="likelyhoodUse" type="xs:boolean" minOccurs="0"/>
				</xs:sequence>
			</xs:complexType>
		</xs:element>
		<xs:element name="dosage" type="dosageType" />
	</xs:sequence>
</xs:group>

</xs:schema>